<?xml version="1.0" encoding="UTF-8"?>
<xs:schema xmlns:xs="http://www.w3.org/2001/XMLSchema"
    elementFormDefault="qualified" attributeFormDefault="unqualified">

    <xs:element name="dds" type="DomainAccessRulesNode" />

    <xs:complexType name="DomainAccessRulesNode">
        <xs:sequence minOccurs="1" maxOccurs="1">
            <xs:element name="domain_access_rules" type="DomainAccessRules" />
        </xs:sequence>
    </xs:complexType>

    <xs:complexType name="DomainAccessRules">
        <xs:sequence minOccurs="1" maxOccurs="unbounded">
            <xs:element name="domain_rule" type="DomainRule" />
        </xs:sequence>
    </xs:complexType>

    <xs:complexType name="DomainRule">
        <xs:sequence minOccurs="1" maxOccurs="1">
            <!-- DDSSEC-75 -->
            <xs:element name="domains" type="DomainIdSet" />
            <xs:element name="allow_unauthenticated_participants" type="xs:boolean" /> <!-- DDSSEC-130 -->
            <xs:element name="enable_join_access_control" type="xs:boolean" /> <!-- DDSSEC-130 -->
            <xs:element name="discovery_protection_kind" type="ProtectionKind" />
            <xs:element name="liveliness_protection_kind" type="ProtectionKind" />
            <xs:element name="rtps_protection_kind" type="ProtectionKind" />
            <xs:element name="topic_access_rules" type="TopicAccessRules" />
        </xs:sequence>
    </xs:complexType>

    <!-- DDSSEC-75 -->
    <xs:complexType name="DomainIdSet">
        <xs:choice minOccurs="1" maxOccurs="unbounded">
            <xs:element name="id" type="DomainId" />
            <xs:element name="id_range" type="DomainIdRange" />
        </xs:choice>
    </xs:complexType>

    <!-- DDSSEC-75 -->
    <xs:simpleType name="DomainId">
        <xs:restriction base="xs:nonNegativeInteger" />
    </xs:simpleType>

    <!-- DDSSEC-75 -->
    <xs:complexType name="DomainIdRange">
        <!-- DDSSEC-130 -->
        <xs:choice>
            <xs:sequence>
                <xs:element name="min" type="DomainId" />
                <xs:element name="max" type="DomainId" minOccurs="0" />
            </xs:sequence>
            <xs:element name="max" type="DomainId" />
        </xs:choice>
    </xs:complexType>

    <!-- DDSSEC11-11 -->
    <xs:simpleType name="ProtectionKind">
        <xs:restriction base="xs:string">
            <xs:enumeration value="ENCRYPT_WITH_ORIGIN_AUTHENTICATION" />
            <xs:enumeration value="SIGN_WITH_ORIGIN_AUTHENTICATION" />
            <xs:enumeration value="ENCRYPT" />
            <xs:enumeration value="SIGN" />
            <xs:enumeration value="NONE" />
        </xs:restriction>
    </xs:simpleType>

    <!-- DDSSEC11-11 -->
    <xs:simpleType name="BasicProtectionKind">
        <xs:restriction base="ProtectionKind">
            <xs:enumeration value="ENCRYPT" />
            <xs:enumeration value="SIGN" />
            <xs:enumeration value="NONE" />
        </xs:restriction>
    </xs:simpleType>


    <!--  DDSSEC-130 removed BooleanKind
    <xs:simpleType name="BooleanKind">
        <xs:restriction base="xs:string">
            <xs:enumeration value="TRUE" />
            <xs:enumeration value="FALSE" />
        </xs:restriction>
    </xs:simpleType>
    -->
    <xs:complexType name="TopicAccessRules">
        <xs:sequence minOccurs="1" maxOccurs="unbounded">
            <xs:element name="topic_rule" type="TopicRule" />
        </xs:sequence>
    </xs:complexType>

    <xs:complexType name="TopicRule">
        <xs:sequence minOccurs="1" maxOccurs="1">
            <xs:element name="topic_expression" type="TopicExpression" />
            <xs:element name="enable_discovery_protection" type="xs:boolean" /> <!-- DDSSEC-130 -->
            <!-- DDSSEC11-85 -->
            <xs:element name="enable_liveliness_protection" type="xs:boolean" />
            <xs:element name="enable_read_access_control" type="xs:boolean" />  <!-- DDSSEC-130 -->
            <xs:element name="enable_write_access_control" type="xs:boolean" /> <!-- DDSSEC-130 -->
            <xs:element name="metadata_protection_kind" type="ProtectionKind" />
            <!-- DDSSEC11-11 -->
            <xs:element name="data_protection_kind" type="BasicProtectionKind" />
        </xs:sequence>
    </xs:complexType>


    <xs:simpleType name="TopicExpression">
        <xs:restriction base="xs:string" />
    </xs:simpleType>

</xs:schema>
